  Trial 277 | Epoch 090 | GP NLPD: 160635.55 | JEPA Loss:   0.62 | SR: 1.94
  Trial 277 | Epoch 100 | GP NLPD: 160389.22 | JEPA Loss:   0.61 | SR: 1.95
  Trial 277 | Epoch 110 | GP NLPD: 158684.22 | JEPA Loss:   0.61 | SR: 1.97
  Trial 277 | Epoch 120 | GP NLPD: 159617.71 | JEPA Loss:   0.59 | SR: 2.00
  Trial 277 | Epoch 130 | GP NLPD: 160155.06 | JEPA Loss:   0.59 | SR: 1.98
  Trial 277 | Epoch 140 | GP NLPD: 160304.33 | JEPA Loss:   0.57 | SR: 2.01
  Trial 277 | Epoch 150 | GP NLPD: 160939.74 | JEPA Loss:   0.57 | SR: 1.92
  Trial 277 | Epoch 160 | GP NLPD: 161430.47 | JEPA Loss:   0.56 | SR: 2.01
  Trial 277 | Epoch 170 | GP NLPD: 162452.68 | JEPA Loss:   0.57 | SR: 2.00
  Trial 277 | Epoch 180 | GP NLPD: 163950.96 | JEPA Loss:   0.58 | SR: 1.99
  Trial 277 | Epoch 190 | GP NLPD: 162895.59 | JEPA Loss:   0.60 | SR: 1.89
  Trial 277 | Epoch 200 | GP NLPD: 163832.96 | JEPA Loss:   0.61 | SR: 1.91
  Trial 277 | Epoch 210 | GP NLPD: 161767.03 | JEPA Loss:   0.61 | SR: 1.97
  Trial 277 | Epoch 220 | GP NLPD: 161672.17 | JEPA Loss:   0.62 | SR: 1.94
  Trial 277 | Epoch 230 | GP NLPD: 159055.31 | JEPA Loss:   0.64 | SR: 1.95
  Trial 277 | Epoch 240 | GP NLPD: 159467.10 | JEPA Loss:   0.69 | SR: 1.87
  Trial 277 | Epoch 250 | GP NLPD: 157400.00 | JEPA Loss:   0.70 | SR: 1.85
  Trial 277 | Epoch 260 | GP NLPD: 156431.88 | JEPA Loss:   0.73 | SR: 1.75
  Trial 277 | Epoch 270 | GP NLPD: 155533.74 | JEPA Loss:   0.76 | SR: 1.73
  Trial 277 | Epoch 280 | GP NLPD: 155193.55 | JEPA Loss:   0.81 | SR: 1.63
  Trial 277 | Epoch 290 | GP NLPD: 155271.99 | JEPA Loss:   0.81 | SR: 1.60
  Trial 277 | Epoch 299 | GP NLPD: 153371.52 | JEPA Loss:   0.77 | SR: 1.67
[I 2026-09-04 01:40:47,764] Trial 277 finished with values: [153294.29947916666, 0.7744255252182484, -1.5631144642829895] and parameters: {'encoder_layers': 3, 'encoder_hidden': 32, 'latent_dim': 5, 'gp_num_inducing': 128, 'gp_kernel': 'Matern12', 'gp_periodic': False, 'gp_composition': 'multiplicative', 'gp_mean': 'Constant', 'lr': 0.0019813680245228385, 'gp_lr': 0.002228851271591878, 'var_weight': 27.8191887647068, 'cov_weight': 27.571508099224296, 'topo_weight': 2.804988248611534, 'ema_tau': 0.9917082375834424, 'aug_noise': 0.10059698345924838, 'aug_dropout': 0.15342346279266736}.
  Trial 278: JIT compilation took 0.0s
  Trial 278 | Epoch 000 | GP NLPD: 230430.91 | JEPA Loss:   0.75 | SR: 2.62
  Trial 278 | Epoch 010 | GP NLPD: 244869.67 | JEPA Loss:   0.53 | SR: 3.76
  Trial 278 | Epoch 020 | GP NLPD: 251579.25 | JEPA Loss:   0.66 | SR: 3.60
  Trial 278 | Epoch 030 | GP NLPD: 253512.50 | JEPA Loss:   0.98 | SR: 3.02
  Trial 278 | Epoch 040 | GP NLPD: 255202.64 | JEPA Loss:   1.13 | SR: 2.67
  Trial 278 | Epoch 050 | GP NLPD: 256380.40 | JEPA Loss:   1.20 | SR: 2.49
  Trial 278 | Epoch 060 | GP NLPD: 257247.95 | JEPA Loss:   1.32 | SR: 2.40
  Trial 278 | Epoch 070 | GP NLPD: 258119.61 | JEPA Loss:   1.35 | SR: 2.36
  Trial 278 | Epoch 080 | GP NLPD: 259226.41 | JEPA Loss:   1.25 | SR: 2.34
  Trial 278 | Epoch 090 | GP NLPD: 260355.96 | JEPA Loss:   1.35 | SR: 2.35
  Trial 278 | Epoch 100 | GP NLPD: 261982.86 | JEPA Loss:   1.33 | SR: 2.33
  Trial 278 | Epoch 110 | GP NLPD: 263514.12 | JEPA Loss:   1.35 | SR: 2.32
  Trial 278 | Epoch 120 | GP NLPD: 264311.82 | JEPA Loss:   1.32 | SR: 2.28
  Trial 278 | Epoch 130 | GP NLPD: 265661.91 | JEPA Loss:   1.32 | SR: 2.31
  Trial 278 | Epoch 140 | GP NLPD: 267154.85 | JEPA Loss:   1.26 | SR: 2.25
  Trial 278 | Epoch 150 | GP NLPD: 268777.98 | JEPA Loss:   1.22 | SR: 2.23
  Trial 278 | Epoch 160 | GP NLPD: 269911.40 | JEPA Loss:   1.26 | SR: 2.17
  Trial 278 | Epoch 170 | GP NLPD: 271539.04 | JEPA Loss:   1.20 | SR: 2.13
  Trial 278 | Epoch 180 | GP NLPD: 273614.09 | JEPA Loss:   1.16 | SR: 2.10
  Trial 278 | Epoch 190 | GP NLPD: 275181.94 | JEPA Loss:   1.23 | SR: 2.08
  Trial 278 | Epoch 200 | GP NLPD: 275172.57 | JEPA Loss:   1.19 | SR: 2.02
  Trial 278 | Epoch 210 | GP NLPD: 276091.45 | JEPA Loss:   1.14 | SR: 1.98
  Trial 278 | Epoch 220 | GP NLPD: 277160.53 | JEPA Loss:   1.19 | SR: 1.90
  Trial 278 | Epoch 230 | GP NLPD: 278124.41 | JEPA Loss:   1.16 | SR: 1.88
  Trial 278 | Epoch 240 | GP NLPD: 279131.74 | JEPA Loss:   1.13 | SR: 1.84
  Trial 278 | Epoch 250 | GP NLPD: 278502.14 | JEPA Loss:   1.17 | SR: 1.78
  Trial 278 | Epoch 260 | GP NLPD: 279007.06 | JEPA Loss:   1.18 | SR: 1.75
  Trial 278 | Epoch 270 | GP NLPD: 279593.30 | JEPA Loss:   1.16 | SR: 1.72
  Trial 278 | Epoch 280 | GP NLPD: 280316.58 | JEPA Loss:   1.24 | SR: 1.67
  Trial 278 | Epoch 290 | GP NLPD: 280876.60 | JEPA Loss:   1.23 | SR: 1.63
  Trial 278 | Epoch 299 | GP NLPD: 281812.43 | JEPA Loss:   1.22 | SR: 1.63
[I 2026-09-04 01:41:34,099] Trial 278 finished with values: [253512.5, 0.9809593694905441, -3.0153249899546304] and parameters: {'encoder_layers': 3, 'encoder_hidden': 32, 'latent_dim': 8, 'gp_num_inducing': 256, 'gp_kernel': 'Matern32', 'gp_periodic': False, 'gp_composition': 'additive', 'gp_mean': 'Constant', 'lr': 0.00016840094149922307, 'gp_lr': 0.0013280937386229983, 'var_weight': 34.701261870469516, 'cov_weight': 40.536142928426436, 'topo_weight': 4.629866469735148, 'ema_tau': 0.9939849744560338, 'aug_noise': 0.003053042833115383, 'aug_dropout': 0.08333322854493784}.
  Trial 279: JIT compilation took 0.0s
  Trial 279 | Epoch 000 | GP NLPD: 153465.35 | JEPA Loss:   0.61 | SR: 2.03
  Trial 279 | Epoch 010 | GP NLPD: 197469.43 | JEPA Loss:   0.67 | SR: 2.13
  Trial 279 | Epoch 020 | GP NLPD: 179587.78 | JEPA Loss:   0.69 | SR: 1.76
  Trial 279 | Epoch 030 | GP NLPD: 166305.88 | JEPA Loss:   0.69 | SR: 1.65
  Trial 279 | Epoch 040 | GP NLPD: 154089.26 | JEPA Loss:   0.67 | SR: 1.75
  Trial 279 | Epoch 050 | GP NLPD: 139715.27 | JEPA Loss:   0.64 | SR: 1.71
  Trial 279 | Epoch 060 | GP NLPD: 124351.75 | JEPA Loss:   0.78 | SR: 1.52
  Trial 279 | Epoch 070 | GP NLPD: 122890.47 | JEPA Loss:   0.80 | SR: 1.45
  Trial 279 | Epoch 080 | GP NLPD: 123281.39 | JEPA Loss:   0.85 | SR: 1.50
  Trial 279 | Epoch 090 | GP NLPD: 121706.91 | JEPA Loss:   0.80 | SR: 1.55
  Trial 279 | Epoch 100 | GP NLPD: 121646.70 | JEPA Loss:   0.80 | SR: 1.55
  Trial 279 | Epoch 110 | GP NLPD: 120049.90 | JEPA Loss:   0.76 | SR: 1.57
  Trial 279 | Epoch 120 | GP NLPD: 119655.62 | JEPA Loss:   0.77 | SR: 1.60
  Trial 279 | Epoch 130 | GP NLPD: 118579.41 | JEPA Loss:   0.79 | SR: 1.68
  Trial 279 | Epoch 140 | GP NLPD: 116785.30 | JEPA Loss:   0.74 | SR: 1.72
  Trial 279 | Epoch 150 | GP NLPD: 117473.31 | JEPA Loss:   0.74 | SR: 1.72
  Trial 279 | Epoch 160 | GP NLPD: 117539.24 | JEPA Loss:   0.75 | SR: 1.66
  Trial 279 | Epoch 170 | GP NLPD: 117288.36 | JEPA Loss:   0.72 | SR: 1.72
  Trial 279 | Epoch 180 | GP NLPD: 118351.34 | JEPA Loss:   0.70 | SR: 1.82
  Trial 279 | Epoch 190 | GP NLPD: 117321.32 | JEPA Loss:   0.70 | SR: 1.76
  Trial 279 | Epoch 200 | GP NLPD: 118093.78 | JEPA Loss:   0.70 | SR: 1.75
  Trial 279 | Epoch 210 | GP NLPD: 119382.04 | JEPA Loss:   0.67 | SR: 1.79
  Trial 279 | Epoch 220 | GP NLPD: 119409.28 | JEPA Loss:   0.66 | SR: 1.80
  Trial 279 | Epoch 230 | GP NLPD: 121062.38 | JEPA Loss:   0.70 | SR: 1.76
  Trial 279 | Epoch 240 | GP NLPD: 120253.43 | JEPA Loss:   0.67 | SR: 1.75
  Trial 279 | Epoch 250 | GP NLPD: 122383.09 | JEPA Loss:   0.65 | SR: 1.79
  Trial 279 | Epoch 260 | GP NLPD: 123041.23 | JEPA Loss:   0.65 | SR: 1.76
  Trial 279 | Epoch 270 | GP NLPD: 124562.15 | JEPA Loss:   0.64 | SR: 1.77
  Trial 279 | Epoch 280 | GP NLPD: 126199.24 | JEPA Loss:   0.64 | SR: 1.80
  Trial 279 | Epoch 290 | GP NLPD: 125840.78 | JEPA Loss:   0.64 | SR: 1.76
  Trial 279 | Epoch 299 | GP NLPD: 125962.76 | JEPA Loss:   0.65 | SR: 1.79
[I 2026-09-04 01:42:25,274] Trial 279 finished with values: [115211.80729166667, 0.7302738204598427, -1.7086663842201233] and parameters: {'encoder_layers': 2, 'encoder_hidden': 64, 'latent_dim': 4, 'gp_num_inducing': 512, 'gp_kernel': 'RBF', 'gp_periodic': False, 'gp_composition': 'multiplicative', 'gp_mean': 'Constant', 'lr': 0.0008681408145019698, 'gp_lr': 0.015958729947080228, 'var_weight': 45.83676974462478, 'cov_weight': 45.197479452435736, 'topo_weight': 2.804988248611534, 'ema_tau': 0.9905951340409401, 'aug_noise': 0.11949200015840532, 'aug_dropout': 0.2807929211166537}.
  Trial 280: JIT compilation took 0.0s
  Trial 280 | Epoch 000 | GP NLPD: 259711.30 | JEPA Loss:   0.72 | SR: 3.14
  Trial 280 | Epoch 010 | GP NLPD: 293626.77 | JEPA Loss:   0.58 | SR: 3.58
  Trial 280 | Epoch 020 | GP NLPD: 287026.45 | JEPA Loss:   0.68 | SR: 3.06
  Trial 280 | Epoch 030 | GP NLPD: 278335.32 | JEPA Loss:   0.75 | SR: 2.83
  Trial 280 | Epoch 040 | GP NLPD: 275434.90 | JEPA Loss:   0.76 | SR: 2.68
  Trial 280 | Epoch 050 | GP NLPD: 271169.11 | JEPA Loss:   0.76 | SR: 2.63
  Trial 280 | Epoch 060 | GP NLPD: 267250.15 | JEPA Loss:   0.77 | SR: 2.59
  Trial 280 | Epoch 070 | GP NLPD: 264735.71 | JEPA Loss:   0.78 | SR: 2.55
  Trial 280 | Epoch 080 | GP NLPD: 263948.81 | JEPA Loss:   0.79 | SR: 2.55
  Trial 280 | Epoch 090 | GP NLPD: 263476.30 | JEPA Loss:   0.80 | SR: 2.53
  Trial 280 | Epoch 100 | GP NLPD: 263858.42 | JEPA Loss:   0.80 | SR: 2.52
  Trial 280 | Epoch 110 | GP NLPD: 263595.33 | JEPA Loss:   0.80 | SR: 2.50
  Trial 280 | Epoch 120 | GP NLPD: 263516.45 | JEPA Loss:   0.81 | SR: 2.50
  Trial 280 | Epoch 130 | GP NLPD: 263696.71 | JEPA Loss:   0.82 | SR: 2.52
  Trial 280 | Epoch 140 | GP NLPD: 263988.06 | JEPA Loss:   0.81 | SR: 2.52
  Trial 280 | Epoch 150 | GP NLPD: 263900.69 | JEPA Loss:   0.81 | SR: 2.54
  Trial 280 | Epoch 160 | GP NLPD: 264726.80 | JEPA Loss:   0.81 | SR: 2.56
  Trial 280 | Epoch 170 | GP NLPD: 265582.40 | JEPA Loss:   0.81 | SR: 2.60
  Trial 280 | Epoch 180 | GP NLPD: 266336.42 | JEPA Loss:   0.82 | SR: 2.59
  Trial 280 | Epoch 190 | GP NLPD: 267399.68 | JEPA Loss:   0.79 | SR: 2.66
  Trial 280 | Epoch 200 | GP NLPD: 268283.32 | JEPA Loss:   0.79 | SR: 2.66
  Trial 280 | Epoch 210 | GP NLPD: 269877.96 | JEPA Loss:   0.80 | SR: 2.70
  Trial 280 | Epoch 220 | GP NLPD: 271099.78 | JEPA Loss:   0.78 | SR: 2.72
  Trial 280 | Epoch 230 | GP NLPD: 273016.31 | JEPA Loss:   0.78 | SR: 2.73
  Trial 280 | Epoch 240 | GP NLPD: 274135.90 | JEPA Loss:   0.77 | SR: 2.75
  Trial 280 | Epoch 250 | GP NLPD: 274894.84 | JEPA Loss:   0.78 | SR: 2.75
  Trial 280 | Epoch 260 | GP NLPD: 276298.64 | JEPA Loss:   0.78 | SR: 2.73
  Trial 280 | Epoch 270 | GP NLPD: 277567.38 | JEPA Loss:   0.78 | SR: 2.75
  Trial 280 | Epoch 280 | GP NLPD: 278844.05 | JEPA Loss:   0.78 | SR: 2.77
  Trial 280 | Epoch 290 | GP NLPD: 279670.58 | JEPA Loss:   0.79 | SR: 2.74
  Trial 280 | Epoch 299 | GP NLPD: 280103.82 | JEPA Loss:   0.79 | SR: 2.72
[I 2026-09-04 01:43:19,674] Trial 280 finished with values: [263320.6171875, 0.8088475801050663, -2.5134658018747964] and parameters: {'encoder_layers': 2, 'encoder_hidden': 32, 'latent_dim': 9, 'gp_num_inducing': 512, 'gp_kernel': 'RBF', 'gp_periodic': True, 'gp_composition': 'additive', 'gp_mean': 'Zero', 'lr': 0.0002166595521301043, 'gp_lr': 0.0013280937386229983, 'var_weight': 22.86628996503969, 'cov_weight': 44.334893952817794, 'topo_weight': 4.629866469735148, 'ema_tau': 0.9917082375834424, 'aug_noise': 0.09508627802450437, 'aug_dropout': 0.16803956709965245}.
  Trial 281: JIT compilation took 0.0s
  Trial 281 | Epoch 000 | GP NLPD: 284941.49 | JEPA Loss:   0.78 | SR: 2.42
  Trial 281 | Epoch 010 | GP NLPD: 319943.78 | JEPA Loss:   0.66 | SR: 3.74
  Trial 281 | Epoch 020 | GP NLPD: 322045.08 | JEPA Loss:   0.67 | SR: 3.69
  Trial 281 | Epoch 030 | GP NLPD: 322212.99 | JEPA Loss:   0.67 | SR: 3.60
  Trial 281 | Epoch 040 | GP NLPD: 322374.66 | JEPA Loss:   0.72 | SR: 3.42
  Trial 281 | Epoch 050 | GP NLPD: 321885.93 | JEPA Loss:   0.77 | SR: 3.10
  Trial 281 | Epoch 060 | GP NLPD: 318495.63 | JEPA Loss:   0.80 | SR: 2.90
  Trial 281 | Epoch 070 | GP NLPD: 315316.94 | JEPA Loss:   0.82 | SR: 2.76
  Trial 281 | Epoch 080 | GP NLPD: 313236.25 | JEPA Loss:   0.81 | SR: 2.73
  Trial 281 | Epoch 090 | GP NLPD: 311836.10 | JEPA Loss:   0.82 | SR: 2.68
  Trial 281 | Epoch 100 | GP NLPD: 311268.39 | JEPA Loss:   0.82 | SR: 2.67
  Trial 281 | Epoch 110 | GP NLPD: 311859.38 | JEPA Loss:   0.82 | SR: 2.63
  Trial 281 | Epoch 120 | GP NLPD: 312611.06 | JEPA Loss:   0.82 | SR: 2.64
  Trial 281 | Epoch 130 | GP NLPD: 314451.82 | JEPA Loss:   0.82 | SR: 2.64
  Trial 281 | Epoch 140 | GP NLPD: 315995.06 | JEPA Loss:   0.82 | SR: 2.64
  Trial 281 | Epoch 150 | GP NLPD: 316192.78 | JEPA Loss:   0.82 | SR: 2.68
  Trial 281 | Epoch 160 | GP NLPD: 317282.53 | JEPA Loss:   0.82 | SR: 2.68
  Trial 281 | Epoch 170 | GP NLPD: 318377.70 | JEPA Loss:   0.82 | SR: 2.69
  Trial 281 | Epoch 180 | GP NLPD: 319457.46 | JEPA Loss:   0.82 | SR: 2.69
  Trial 281 | Epoch 190 | GP NLPD: 320229.99 | JEPA Loss:   0.81 | SR: 2.69
  Trial 281 | Epoch 200 | GP NLPD: 321360.99 | JEPA Loss:   0.82 | SR: 2.67
  Trial 281 | Epoch 210 | GP NLPD: 322150.19 | JEPA Loss:   0.81 | SR: 2.67
  Trial 281 | Epoch 220 | GP NLPD: 322905.67 | JEPA Loss:   0.82 | SR: 2.65
  Trial 281 | Epoch 230 | GP NLPD: 323061.08 | JEPA Loss:   0.81 | SR: 2.68
  Trial 281 | Epoch 240 | GP NLPD: 323566.53 | JEPA Loss:   0.82 | SR: 2.67
  Trial 281 | Epoch 250 | GP NLPD: 323924.45 | JEPA Loss:   0.81 | SR: 2.69
  Trial 281 | Epoch 260 | GP NLPD: 324131.16 | JEPA Loss:   0.81 | SR: 2.69
  Trial 281 | Epoch 270 | GP NLPD: 324462.99 | JEPA Loss:   0.82 | SR: 2.68
  Trial 281 | Epoch 280 | GP NLPD: 324851.95 | JEPA Loss:   0.82 | SR: 2.66
  Trial 281 | Epoch 290 | GP NLPD: 325187.10 | JEPA Loss:   0.82 | SR: 2.66
  Trial 281 | Epoch 299 | GP NLPD: 325519.52 | JEPA Loss:   0.82 | SR: 2.63
[I 2026-09-04 01:43:57,305] Trial 281 finished with values: [311268.390625, 0.8224126485486825, -2.6706532637278237] and parameters: {'encoder_layers': 2, 'encoder_hidden': 32, 'latent_dim': 10, 'gp_num_inducing': 128, 'gp_kernel': 'Matern12', 'gp_periodic': False, 'gp_composition': 'additive', 'gp_mean': 'Zero', 'lr': 0.0002166595521301043, 'gp_lr': 0.002228851271591878, 'var_weight': 27.8191887647068, 'cov_weight': 45.197479452435736, 'topo_weight': 2.804988248611534, 'ema_tau': 0.9917082375834424, 'aug_noise': 0.15304983261181604, 'aug_dropout': 0.15342346279266736}.
  Trial 282: JIT compilation took 0.0s
  Trial 282 | Epoch 000 | GP NLPD: 109461.67 | JEPA Loss:   0.61 | SR: 2.15
  Trial 282 | Epoch 010 | GP NLPD: 115477.91 | JEPA Loss:   0.71 | SR: 1.90
  Trial 282 | Epoch 020 | GP NLPD: 141499.99 | JEPA Loss:   0.81 | SR: 1.66
  Trial 282 | Epoch 030 | GP NLPD: 148302.23 | JEPA Loss:   0.92 | SR: 1.56
  Trial 282 | Epoch 040 | GP NLPD: 148937.96 | JEPA Loss:   1.01 | SR: 1.49
  Trial 282 | Epoch 050 | GP NLPD: 146385.71 | JEPA Loss:   1.10 | SR: 1.47
  Trial 282 | Epoch 060 | GP NLPD: 141392.07 | JEPA Loss:   1.09 | SR: 1.46
  Trial 282 | Epoch 070 | GP NLPD: 134732.73 | JEPA Loss:   1.03 | SR: 1.50
  Trial 282 | Epoch 080 | GP NLPD: 127028.78 | JEPA Loss:   0.90 | SR: 1.52
  Trial 282 | Epoch 090 | GP NLPD: 120825.31 | JEPA Loss:   0.84 | SR: 1.51
  Trial 282 | Epoch 100 | GP NLPD: 118375.00 | JEPA Loss:   0.81 | SR: 1.51
  Trial 282 | Epoch 110 | GP NLPD: 118302.28 | JEPA Loss:   0.77 | SR: 1.55
  Trial 282 | Epoch 120 | GP NLPD: 119355.33 | JEPA Loss:   0.76 | SR: 1.56
  Trial 282 | Epoch 130 | GP NLPD: 120571.75 | JEPA Loss:   0.73 | SR: 1.63
  Trial 282 | Epoch 140 | GP NLPD: 121680.54 | JEPA Loss:   0.73 | SR: 1.64
  Trial 282 | Epoch 150 | GP NLPD: 123177.19 | JEPA Loss:   0.72 | SR: 1.67
  Trial 282 | Epoch 160 | GP NLPD: 125043.60 | JEPA Loss:   0.71 | SR: 1.71
  Trial 282 | Epoch 170 | GP NLPD: 127014.28 | JEPA Loss:   0.70 | SR: 1.75
  Trial 282 | Epoch 180 | GP NLPD: 129070.91 | JEPA Loss:   0.70 | SR: 1.74
  Trial 282 | Epoch 190 | GP NLPD: 130919.11 | JEPA Loss:   0.69 | SR: 1.78
  Trial 282 | Epoch 200 | GP NLPD: 132454.32 | JEPA Loss:   0.68 | SR: 1.81
  Trial 282 | Epoch 210 | GP NLPD: 134179.30 | JEPA Loss:   0.67 | SR: 1.85
  Trial 282 | Epoch 220 | GP NLPD: 135647.23 | JEPA Loss:   0.67 | SR: 1.85
  Trial 282 | Epoch 230 | GP NLPD: 137554.82 | JEPA Loss:   0.65 | SR: 1.95
  Trial 282 | Epoch 240 | GP NLPD: 139768.20 | JEPA Loss:   0.64 | SR: 2.01
  Trial 282 | Epoch 250 | GP NLPD: 141565.12 | JEPA Loss:   0.62 | SR: 2.02
  Trial 282 | Epoch 260 | GP NLPD: 142735.51 | JEPA Loss:   0.62 | SR: 2.05
  Trial 282 | Epoch 270 | GP NLPD: 144442.52 | JEPA Loss:   0.61 | SR: 2.06
  Trial 282 | Epoch 280 | GP NLPD: 145671.56 | JEPA Loss:   0.61 | SR: 2.05
  Trial 282 | Epoch 290 | GP NLPD: 148335.77 | JEPA Loss:   0.62 | SR: 2.00
  Trial 282 | Epoch 299 | GP NLPD: 150607.32 | JEPA Loss:   0.63 | SR: 1.98
[I 2026-09-04 01:44:42,217] Trial 282 finished with values: [117953.20703125, 0.7952676638960838, -1.5324615041414897] and parameters: {'encoder_layers': 3, 'encoder_hidden': 32, 'latent_dim': 4, 'gp_num_inducing': 256, 'gp_kernel': 'RBF', 'gp_periodic': False, 'gp_composition': 'multiplicative', 'gp_mean': 'Constant', 'lr': 0.00030287453488654767, 'gp_lr': 0.043110414524021444, 'var_weight': 22.86628996503969, 'cov_weight': 36.32427556011761, 'topo_weight': 4.498129400339861, 'ema_tau': 0.997626792078338, 'aug_noise': 0.026102268557593213, 'aug_dropout': 0.386771114930245}.
  Trial 283: JIT compilation took 0.0s
  Trial 283 | Epoch 000 | GP NLPD:  94892.35 | JEPA Loss:   0.53 | SR: 2.22
  Trial 283 | Epoch 010 | GP NLPD: 131790.32 | JEPA Loss:   0.60 | SR: 1.84
  Trial 283 | Epoch 020 | GP NLPD: 149818.20 | JEPA Loss:   1.19 | SR: 1.35
  Trial 283 | Epoch 030 | GP NLPD: 157350.09 | JEPA Loss:   1.11 | SR: 1.38
  Trial 283 | Epoch 040 | GP NLPD: 157891.54 | JEPA Loss:   1.07 | SR: 1.42
  Trial 283 | Epoch 050 | GP NLPD: 157826.43 | JEPA Loss:   1.05 | SR: 1.53
  Trial 283 | Epoch 060 | GP NLPD: 156119.82 | JEPA Loss:   1.01 | SR: 1.59
  Trial 283 | Epoch 070 | GP NLPD: 157000.82 | JEPA Loss:   1.01 | SR: 1.61
  Trial 283 | Epoch 080 | GP NLPD: 153503.58 | JEPA Loss:   0.93 | SR: 1.58
  Trial 283 | Epoch 090 | GP NLPD: 151419.34 | JEPA Loss:   0.86 | SR: 1.55
  Trial 283 | Epoch 100 | GP NLPD: 145506.80 | JEPA Loss:   0.77 | SR: 1.55
  Trial 283 | Epoch 110 | GP NLPD: 138587.56 | JEPA Loss:   0.73 | SR: 1.52
  Trial 283 | Epoch 120 | GP NLPD: 130004.90 | JEPA Loss:   0.73 | SR: 1.49
  Trial 283 | Epoch 130 | GP NLPD: 126053.32 | JEPA Loss:   0.71 | SR: 1.49
  Trial 283 | Epoch 140 | GP NLPD: 125814.95 | JEPA Loss:   0.74 | SR: 1.45
  Trial 283 | Epoch 150 | GP NLPD: 131128.85 | JEPA Loss:   0.74 | SR: 1.42
  Trial 283 | Epoch 160 | GP NLPD: 132765.26 | JEPA Loss:   0.72 | SR: 1.44
  Trial 283 | Epoch 170 | GP NLPD: 134153.41 | JEPA Loss:   0.71 | SR: 1.45
  Trial 283 | Epoch 180 | GP NLPD: 137620.99 | JEPA Loss:   0.70 | SR: 1.47
  Trial 283 | Epoch 190 | GP NLPD: 137661.51 | JEPA Loss:   0.70 | SR: 1.50
  Trial 283 | Epoch 200 | GP NLPD: 135950.19 | JEPA Loss:   0.68 | SR: 1.54
  Trial 283 | Epoch 210 | GP NLPD: 140731.89 | JEPA Loss:   0.72 | SR: 1.56
  Trial 283 | Epoch 220 | GP NLPD: 142552.62 | JEPA Loss:   0.69 | SR: 1.59
  Trial 283 | Epoch 230 | GP NLPD: 143028.45 | JEPA Loss:   0.68 | SR: 1.63
  Trial 283 | Epoch 240 | GP NLPD: 144941.77 | JEPA Loss:   0.67 | SR: 1.66
  Trial 283 | Epoch 250 | GP NLPD: 146465.85 | JEPA Loss:   0.67 | SR: 1.66
  Trial 283 | Epoch 260 | GP NLPD: 143114.42 | JEPA Loss:   0.66 | SR: 1.74
  Trial 283 | Epoch 270 | GP NLPD: 144236.58 | JEPA Loss:   0.70 | SR: 1.69
  Trial 283 | Epoch 280 | GP NLPD: 143551.14 | JEPA Loss:   0.66 | SR: 1.76
  Trial 283 | Epoch 290 | GP NLPD: 141650.61 | JEPA Loss:   0.72 | SR: 1.80
  Trial 283 | Epoch 299 | GP NLPD: 143590.68 | JEPA Loss:   0.68 | SR: 1.80
